{
  "contract_version": "1.0",
  "proposal_id": "oneri-2026-09-08-alt-ajan-tavani",
  "at": "2026-09-08T16:10:00+03:00",
  "author": { "kind": "insan", "name": "furki" },
  "evidence": {
    "run_ids": ["kosu-2026-09-07-i3", "kosu-2026-09-08-i4", "kosu-2026-09-08-i5"],
    "doc_refs": [
      "BILINEN-TUZAKLAR.md:15",
      "BILINEN-TUZAKLAR.md:16",
      "BILINEN-TUZAKLAR.md:17"
    ],
    "window_start": "2026-09-07T00:00:00+03:00",
    "window_end": "2026-09-08T15:00:00+03:00",
    "observation": {
      "counter": "kosu_maliyeti_usd",
      "runs": 3,
      "before": 6.0,
      "after": 1.3
    },
    "summary": "Alt ajan prompt'una klasor kapsami ve arac cagrisi tavani yazilan turda maliyet 3,3 USD'den 1,3 USD'ye dustu; cikti kalitesi dusmedi."
  },
  "target": {
    "kind": "esik",
    "artifact": "docs/00-ARASTIRMA-PROTOKOLU.md",
    "version_before": "1.2"
  },
  "change": {
    "what": "Alt ajan prompt sablonuna uc zorunlu alan eklensin: okunacak klasorler, girilmeyecek klasorler, arac cagrisi tavani.",
    "why": "Maliyeti belirleyen alt ajan sayisi degil, her birinin ne kadar kod okudugu. Kapsam sinirli iki ajan ile sinirsiz iki ajan arasinda 2,5 kat fark olculdu.",
    "risk": "dusuk"
  },
  "gates": {
    "valid": {
      "result": "gecti",
      "method": "node arac/sema-dogrula.js --test",
      "evidence_kind": "test"
    },
    "threshold": {
      "result": "gecti",
      "method": "iki tur maliyet karsilastirmasi (i4 kapsamsiz / i4 kapsamli)",
      "evidence_kind": "olcum",
      "detail": "3,3 USD -> 1,3 USD, esik: en az %30 dusus"
    }
  },
  "status": "ONERILDI"
}
